{"schemaVersion":1,"kind":"final_reviewability_reslicing_packet","feature":{"branch":"doc-002-unified-landing-page-and-ia-shell","feature_dir":"specs/doc-002-unified-landing-page-and-ia-shell","spec_id":"doc-002-unified-landing-page-and-ia-shell","title":"doc-002-unified-landing-page-and-ia-shell"},"diff":{"base_ref":"main","head_ref":"HEAD","base_sha":"e52035516f3434b82d728e32d3834f24400140cd","changed_files":36,"changed_files_path":"specs/doc-002-unified-landing-page-and-ia-shell/.process/final-reviewability/changed-files.txt","gate_input_summary":"final diff reviewability gate"},"gate":{"status":"block","reason":"total files 36 exceeds block threshold 25","metrics":{"reviewable_loc":40,"production_files":2,"total_files":36,"primary_surface_count":5,"primary_surfaces":["API","docs/process","other","scheduler/runtime","seed/config"],"greenfield":false,"thresholds":{"warn":{"reviewable_loc":400,"production_files":6,"total_files":15,"primary_surfaces":1},"block":{"reviewable_loc":800,"production_files":8,"total_files":25,"primary_surfaces":1}},"warnings":["total files 36 exceeds warn threshold 15","primary surfaces 5 exceeds warn threshold 1"],"blockers":["total files 36 exceeds block threshold 25"]}},"exceptions":{"accepted":[],"rejected":[]},"blocked_operations":["pr-body-generation","single-pr-create","multi-pr-emission"],"no_pr_assertions":{"pr_created":false,"pr":null,"pr_body_generated":false,"single_pr_create_invoked":false,"gh_pr_create_invoked":false,"multi_pr_emission_invoked":false},"sizing":{"source":"missing","summary":"Final diff gate requires re-slicing through PRSG-007 sizing context.","route":"split-PR","thresholds":{}},"layer_plan":{"available":false,"status":"missing","path":null,"slice_count":0},"handoff":{"tool":"multi-pr-emission.sh","command_template":"speckit-pro/skills/speckit-autopilot/scripts/multi-pr-emission.sh --layer-plan <layer-plan.json> --state specs/doc-002-unified-landing-page-and-ia-shell/.process/final-reviewability/gate-state.json --feature-branch doc-002-unified-landing-page-and-ia-shell --base main --base-sha e52035516f3434b82d728e32d3834f24400140cd --full-verification-evidence specs/doc-002-unified-landing-page-and-ia-shell/.process/final-reviewability/full-verification-evidence.md --changed-files specs/doc-002-unified-landing-page-and-ia-shell/.process/final-reviewability/changed-files.txt","required_inputs":["<layer-plan.json>","specs/doc-002-unified-landing-page-and-ia-shell/.process/final-reviewability/gate-state.json","specs/doc-002-unified-landing-page-and-ia-shell/.process/final-reviewability/full-verification-evidence.md","specs/doc-002-unified-landing-page-and-ia-shell/.process/final-reviewability/changed-files.txt"],"layer_plan_path":"<layer-plan.json>","state_path":"specs/doc-002-unified-landing-page-and-ia-shell/.process/final-reviewability/gate-state.json","full_verification_evidence_path":"specs/doc-002-unified-landing-page-and-ia-shell/.process/final-reviewability/full-verification-evidence.md","changed_files_path":"specs/doc-002-unified-landing-page-and-ia-shell/.process/final-reviewability/changed-files.txt"},"suggested_slice_boundaries":[{"id":"reslice-1","title":"Regenerate reviewable slices","rationale":"No usable layer plan was available at the final gate boundary.","paths":["specs/doc-002-unified-landing-page-and-ia-shell"]}],"operator_steps":[{"order":1,"phase":"prsg-007-routing","action":"Re-run atomicity routing and sizing context.","command":"speckit-pro/skills/speckit-autopilot/scripts/atomicity-route.sh specs/doc-002-unified-landing-page-and-ia-shell","required_paths":["specs/doc-002-unified-landing-page-and-ia-shell"],"when":"Use when sizing or route evidence is missing, stale, or conflicts with the final diff.","expected_result":"A current PRSG-007 route and thresholds are available for re-slicing."},{"order":2,"phase":"prsg-008-layer-planning","action":"Regenerate the layer plan from the current tasks.","command":"speckit-pro/skills/speckit-autopilot/scripts/plan-layers.sh specs/doc-002-unified-landing-page-and-ia-shell","required_paths":["specs/doc-002-unified-landing-page-and-ia-shell","specs/doc-002-unified-landing-page-and-ia-shell/tasks.md"],"when":"Use when the layer plan is missing, invalid, or stale after PRSG-007 routing.","expected_result":"A valid PRSG-008 layer plan with reviewable slice boundaries is available."},{"order":3,"phase":"prsg-009-multi-pr-emission","action":"Hand off valid slices to multi-PR emission.","command":"speckit-pro/skills/speckit-autopilot/scripts/multi-pr-emission.sh --layer-plan <layer-plan.json> --state specs/doc-002-unified-landing-page-and-ia-shell/.process/final-reviewability/gate-state.json --feature-branch doc-002-unified-landing-page-and-ia-shell --base main --base-sha e52035516f3434b82d728e32d3834f24400140cd","required_paths":["<layer-plan.json>","specs/doc-002-unified-landing-page-and-ia-shell/.process/final-reviewability/gate-state.json"],"when":"Use only after PRSG-007 routing and PRSG-008 layer planning are current and valid.","expected_result":"PRSG-009 emits reviewable PR candidates instead of one oversized PR."}],"resume":{"status":"reslicing_required","next_action":"Refresh PRSG-007 routing and sizing evidence.","operator_message":"Final reviewability gate blocked before PR body generation, gh pr create, or multi-PR emission.","resume_from":"prsg-007-routing","blocked_until":"A valid reviewable slice plan exists or an explicit operator-owned typed exception is committed."}}
